unit_id,notif_type,comment
100101,1,"スタミナ全回復っ！あたしも元気満タンだよ！準備が出来たら、冒険へレッツゴー！"
100101,2,"ギルドハウスのスキップチケットがいっぱいだって！パパッとやっつけちゃうよー！"
100101,3,"騎士くん！ギルドハウスのスタミナがいっぱいだよ！困ってる人を助けるには体力が大事だよね！"
100101,4,"ギルドハウスのEXPポーションがいっぱいだね！たくさんもっともーっと飲んで強くなるぞー！"
100101,5,"ギルドハウスのマナがいっぱいになったよ！何に使うか迷っちゃうね！騎士くんはもう決めた？"
100101,6,"やっほー！ギルドハウスのアイテムがぜんぶいっぱいだよ！…もしかして騎士くん、忙しいの？"
100201,1,"騎士クン、スタミナが全回復したよ。…冒険に行くなら、わたしも連れて行って欲しいな"
100201,2,"ギルドハウスのスキップチケットがいっぱいだよ。これがあれば、あんまり戦わなくていいのかな？"
100201,3,"ギルドハウスのスタミナがいっぱいになったよ。…騎士クン。良かったら、一緒にお出かけしない？"
100201,4,"ギルドハウスのEXPポーションがいっぱいになったよ。少しでも、魔法が上手くなるといいな…"
100201,5,"ギルドハウスのマナがいっぱいになったよ。わたしもちょっとは強くなれるかな…？"
100201,6,"騎士クン。ギルドハウスのアイテムがいっぱいになってるから…一緒に、受け取りに行かない？"
100301,1,"スタミナが全回復したね。強くなるためには、実戦で経験を積むのが一番だ。さあ行こう！"
100301,2,"ギルドハウスのスキップチケットがいっぱいだ。敵を楽に倒せるのは、私たちが強くなった証拠だね"
100301,3,"ギルドハウスのスタミナがいっぱいだね。体力を持て余しているなら、修行に付き合って欲しいな"
100301,4,"ギルドハウスのEXPポーションがいっぱいだよ。たゆまぬ研鑽こそが、次の勝利への近道だよ"
100301,5,"ギルドハウスのマナがいっぱいだね。これで剣技により磨きをかけられる。まだまだ強くなれそうだ"
100301,6,"ギルドハウスで受け取れるアイテムがすべていっぱいだよ。早めに受け取っておくこと。いいね？"
100401,1,"にいちゃん、スタミナが全回復したよ！これでミソギと遊びに行けるね！"
100401,2,"ギルドハウスのスキップチケットがいっぱいになったみたい！よーし、にいちゃんと探険に出発だ～！"
100401,3,"ギルドハウスのスタミナがいっぱいになったよ！早くおいでよ、にいちゃん！"
100401,4,"ギルドハウスのEXPポーションがいっぱいだー！ミソギ、にいちゃんより大きくなっちゃうかも！？"
100401,5,"ギルドハウスのマナがいっぱいだよ！ミソギ、新しいイタズラグッズが欲しいな～"
100401,6,"ギルドハウスのアイテムがいっぱいだよ！早く受け取らないと、ミソギがもらっちゃうよ～♪"
100501,1,"スタミナが全回復したッス！ここからスーパーヒーロータイムの始まりッスね！"
100501,2,"ギルドハウスのスキップチケットがいっぱいになったみたいッス！これで冒険が捗るッスね！"
100501,3,"ギルドハウスのスタミナがいっぱいになったッスよ！さあ、世界の平和を守りに出発ッス！"
100501,4,"ギルドハウスのEXPポーションがいっぱいになったッス！絶対無敵のヒーローへの近道ッスね！"
100501,5,"ギルドハウスのマナがいっぱいになったッスね…ひ、ヒーローの人形とか買わないッスか！？"
100501,6,"ギルドハウスで受け取れるアイテムがいっぱいッスよ！回収して冒険の準備を整えるッス！"
100601,1,"スタミナが回復しましたよ。アカリ、またお兄ちゃんとしたいな～♪"
100601,2,"ギルドハウスのスキップチケットがいっぱいです。アカリといっしょにイキましょう～バトルに♪"
100601,3,"ギルドハウスのスタミナが回復したみたい。アカリ、もう待ちきれないです♪"
100601,4,"ギルドハウスのEXPポーションがいっぱいです。アカリ、まだまだ成長しちゃいますよ～♪"
100601,5,"ギルドハウスのマナがいっぱいになりましたよ～アカリ、欲しくてたまらないです～"
100601,6,"お兄ちゃん、いっぱいたまってますよ。ギルドハウスで受け取れるアイテム全部が♪"
100701,1,"スタミナが全回復したの～。とっととプリンを買いに行けなの～"
100701,2,"ギルドハウスのスキップチケットがいっぱいになったの！プリン探しの旅に出かけるの！"
100701,3,"ギルドハウスのスタミナがいっぱいなの～。全部プリンのために使うの～"
100701,4,"ギルドハウスのEXPポーションがいっぱいになったの～。プリンと一緒にミヤコによこすの～"
100701,5,"ギルドハウスのマナがいっぱいになったの！これでプリンがたくさん買えるの～！"
100701,6,"ギルドハウスで貰えるアイテムがいっぱいになったの。とっとと受け取ってミヤコにプリンを献上するの！"
100801,1,"スタミナが回復したようだね。コンディションがベストなボク…つまり完璧なる美ということだよ！"
100801,2,"ギルドハウスのスキップチケットがいっぱいだよ。バトルをスキップして、ボクをじっくり見なよ♪"
100801,3,"ギルドハウスのスタミナが回復したみたいだね。これで美しいボクを万全の状態で見られるね♪"
100801,4,"ギルドハウスのEXPポーションがいっぱいだって。ボクの美がもっと進化しちゃいそう♪"
100801,5,"ギルドハウスのマナがいっぱいだって。ボクへのプレゼントに使ってもいいよ♪"
100801,6,"ギルドハウスで受け取れるアイテムが、全部いっぱいのようだね。それ、全部ボクにくれるのかい？"
100901,1,"シグルドよ、我々のスタミナが全回復したぞ！今こそ前進の時！この疾風の冥姫が敵を蹂躙しよう！"
100901,2,"我々の根城のスキップチケットの貯蔵が限界に達したぞ！遠慮せずに受け取るがいい！"
100901,3,"我々の本拠地のスタミナが今にも溢れそうだ！活力を無駄にするなよ、シグルド！"
100901,4,"ギルドハウスのEXPポーションが補充されたな！更なる力を得て、最強へと近づこうではないか！"
100901,5,"我々のギルドハウスのマナが満杯だぞ！シグルドよ、当然私にも分けてくれるよな？"
100901,6,"ギルドハウスで受け取れるアイテムが限界まで貯まったな！貴様が受け取らないなら、私が頂くぞ？"
101001,1,"スタミナが全回復したみたいやわぁ。一緒にお出かけしまひょ♪"
101001,2,"ギルドハウスのスキップチケットがいっぱいらしいわぁ。楽になるんはええことやねぇ。"
101001,3,"ギルドハウスのスタミナがいっぱいやわぁ。王子はんさえよければ、一緒に見回りにいかへん？"
101001,4,"ギルドハウスのEXPポーションが余っとるんやねぇ。飲んだら、魔法が成功しやすくなるやろか？"
101001,5,"ギルドハウスのマナがいっぱいやわぁ。マナって宝石みたいで綺麗やねぇ♪"
101001,6,"ギルドハウスで受け取れるアイテムが、全部いっぱいどす。王子はんは、はんなりしてはるねぇ♪"
101101,1,"スタミナが回復したみたいですよ！冒険は準備簡単ですね！"
101101,2,"ギルドハウスのスキップチケットがいっぱいです！急がば周れ…バトルを周回しましょう！"
101101,3,"ギルドハウスのスタミナが回復したみたいです！備えあったらうれしいな！ですね"
101101,4,"ギルドハウスのEXPポーションがいっぱいです！良薬口ににんがし…あれ？どう意味？"
101101,5,"ギルドハウスのマナがいっぱいです！金は天からの貰い物…ですね！"
101101,6,"ギルドハウスで受け取れるアイテムがいっぱい！このままだと、宝のお餅が腐っちゃいますよ！"
101201,1,"きら～ん☆　スタミナ全回復～！一緒に困ってる人を助けに行こー！"
101201,2,"わわっ！ギルドハウスのスキップチケットがいっぱいだ！お昼寝の前にお散歩しに行こう～"
101201,3,"むむっ！ハツネちゃん感じるよ！ギルドハウスのスタミナが…いっぱいになりました！"
101201,4,"ギルドハウスのEXPポーションが満タンだよ！これで私の超能…ま、魔法がまた強くなるね！"
101201,5,"ギルドハウスのマナがいっぱいだ～！キミキミ、私にもわけて～"
101201,6,"スヤスヤ…ギルドハウスのアイテム…ぜんぶ…いっぱい…ぐぅ"
101301,1,"スタミナが全回復したでござるよ！いざ、定期巡回に参りましょうぞ！"
101301,2,"ギルドハウスのスキップチケットがいっぱいだね！よーし、伝説の魔導書を探しに行くなり～"
101301,3,"ギルドハウスのスタミナがいっぱいですと！？これは、魔法少女として動き出す時！？"
101301,4,"ギルドハウスのEXPポーションがマックスになったよ！魔法少女に成長はつきものですな！"
101301,5,"ギルドハウスのマナがいっぱいに！？よっしゃー、魔導書買い漁るぞ～！…え、ダメ？"
101301,6,"ギルドハウスで貰えるアイテムがいっぱいだってさ！アイテムはよ！はよ受け取ってクレメンス！"
101401,1,"スタミナが全回復したみたいだね。さあ、楽しい推理の時間の始まりだよ！行こう助手くん！"
101401,2,"ギルドハウスのスキップチケットがいっぱいになったね。推理の効率化に役立てよう！"
101401,3,"ギルドハウスのスタミナがいっぱいになったね。助手くん、これで長時間の調査も問題ないよ！"
101401,4,"ギルドハウスのEXPポーションがいっぱいになったね。レベルを上げて難解な謎に挑戦しよう！"
101401,5,"ギルドハウスのマナがいっぱいになったみたいだね。ありがたい、調査費用に使わせてもらおう！"
101401,6,"ギルドハウスで受け取れるアイテムが、すべていっぱいになったみたいだよ。これで推理が捗るね！"
101501,1,"スタミナが全回復したみたいね～。先生と一緒に遊びに行きましょうか♪"
101501,2,"あらあら、ギルドハウスのスキップチケットがいっぱいだわ。あなたといろんな所に行けるわね～"
101501,3,"ギルドハウスのスタミナがいっぱいみたい。さーて、先生をどこに連れて行ってくれるのかな～？"
101501,4,"ギルドハウスのEXPポーションがいっぱいだわ。みんなの成長が、私のなによりの幸せよ"
101501,5,"まぁ！ギルドハウスのマナがいっぱい！ふふっ、無駄遣いはしないようにね？"
101501,6,"ギルドハウスで受け取れるアイテムがぜーんぶ貯まったみたいね～。忘れずに回収しましょうね～"
101601,1,"スタミナが全回復したみたい！テンション、アゲアゲだね！"
101601,2,"ギルドハウスのスキップチケットがいっぱいみたい！勉強のスキップチケットはないのかな？"
101601,3,"ギルドハウスのスタミナがいっぱいだよ！今日はパーリーパリーだね☆"
101601,4,"ギルドハウスのEXPポーションがいっぱいだって！これでウチの成績も伸びないかな～"
101601,5,"ギルドハウスのマナがいっぱいだよ！二人でショッピングにレッツゴー！"
101601,6,"ギルドハウスで受け取れるアイテムが、全部いっぱいだよ！さー！派手にアゲて、冒険しちゃおうよ！"
101701,1,"ハイタ～イ！スタミナが全回復したし、私と見回りに行くさ～♪"
101701,2,"ギルドハウスのスキップチケットがいっぱいさ～。空手にも冒険にも素早い動きは大事さ～！"
101701,3,"ギルドハウスのスタミナがいっぱいだし、一緒に踊って、歌うさ～！"
101701,4,"ギルドハウスのEXPポーションがいっぱいになったさ～。これを飲めばみんな黒帯さ～！"
101701,5,"ギルドハウスのマナがいっぱいさ～。空手技に磨きをかけることもできるさ～！"
101701,6,"ギルドハウスで受け取れるアイテムが、すべていっぱいさ～。受け取るの手伝うよ～？"
101801,1,"スタミナが全回復したみたいね。今なら補習もたっぷりできそうね…ふふ、がんばりましょ♪"
101801,2,"ギルドハウスのスキップチケットがいっぱいみたい！でも補習授業はスキップできないわよ♪"
101801,3,"ギルドハウスのスタミナがいっぱいみたいね。それじゃあ授業を始めましょう♪"
101801,4,"ギルドハウスのEXPポーションがいっぱいみたい。あなたもドンドン成長しちゃうのね～"
101801,5,"ギルドハウスのマナがいっぱいね！放課後になったら、一緒にショッピングでもする？"
101801,6,"ギルドハウスで受け取れるアイテムが、全部いっぱいよ。万全な状態で、お勉強がんばりましょう♪"
102001,1,"えへへ、スタミナぜんかいふく～♪おにいちゃん、ミミとあそぼー？"
102001,2,"わ～、ギルドハウスのスキップチケットがいっぱい！ミミね、おにいちゃんとお散歩にいきたいな～"
102001,3,"るんたった～るんたった～♪ギルドハウスのスタミナいーっぱい♪おててつないでおでかけしよー？"
102001,4,"ギルドハウスのいーえっくすぴーポーションがいっぱいだよ！ミミ、おねえちゃんになれるかな？"
102001,5,"ん～、なににつかおっかな～。あ、おにいちゃん。ギルドハウスのマナがいっぱいになったよ～"
102001,6,"ギルドハウスのアイテムがぜんぶもらえるよ～。すごーい、ミミもほしいな～"
102101,1,"ス、スタミナが全回復したみたいですぅ…あ、遊んでほしいな…。"
102101,2,"ギルドハウスのスキップチケットがいっぱいですぅ…とっても便利って聞いたよぉ…？"
102101,3,"ギルドハウスのスタミナがいっぱいですぅ…。お、お兄ちゃん、冒険に行きますか…？"
102101,4,"ギルドハウスのEXPポーションがいっぱい…もっと料理が上手くなるかなぁ…？"
102101,5,"ギルドハウスのマナがいっぱいですぅ…無駄遣いしないでくださいね…？"
102101,6,"ギルドハウスで受け取れるアイテムが、全部いっぱいですぅ……お兄ちゃん、人気者ですね…♪"
102201,1,"スタミナが全回復したみたい！さぁ一緒にゲームを楽しみましょう！"
102201,2,"ギルドハウスのスキップチケットがいっぱいになったわ！これで効率的に攻略できるわね！"
102201,3,"ギルドハウスのスタミナがいっぱいになったわ！急いで攻略しないともったいないわよ！"
102201,4,"ギルドハウスのEXPポーションがいっぱいよ。成長すればステータスも上がる！楽しみね～"
102201,5,"ギルドハウスのマナがいっぱいよ。マナを使って色々揃えたら冒険が楽になるわよね！"
102201,6,"ギルドハウスで受け取れるアイテムがいっぱいよ！全部受け取って、冒険の役に立てましょう！"
102301,1,"スタミナが全回復したんだって！お兄ちゃん、一緒にあそぼ！"
102301,2,"ギルドハウスのスキップチケットがいっぱいだよ。いろんなところにお出かけできそうだね！"
102301,3,"ギルドハウスのスタミナがいっぱいだって。お兄ちゃん、一緒に探検に行こっ！"
102301,4,"ギルドハウスのEXPポーションがいっぱいだね！飲めば立派なお姉ちゃんになれるかな…？"
102301,5,"ギルドハウスのマナがいっぱい！お兄ちゃん、マナはとっても大事らしいよ！"
102301,6,"ギルドハウスで受け取れるアイテムが、全部いっぱいだって。贈り物が沢山あっていいなー！"
102501,1,"スタミナが全回復しましたよ～。お出かけするなら、ご一緒しませんか？"
102501,2,"ギルドハウスのスキップチケットがいっぱいです。お仕事もテキパキできたり…しませんよね？"
102501,3,"ギルドハウスのスタミナがいっぱいみたいです。私もあなたのことお待ちしてますよ。"
102501,4,"ギルドハウスのEXPポーションがいっぱいみたいですね～。経験を積めば、ドジも直せますか！？"
102501,5,"ギルドハウスのマナがいっぱいみたいですね～。救護院もこれくらい余裕があればいい暮らしが…！"
102501,6,"ギルドハウスで受け取れるアイテムがいっぱいですね。私が受け取って…はわっ、て、手がすべっ！"
102601,1,"スタミナが全回復したってさ～。ま、あたしは働かないけどね"
102601,2,"ギルドハウスのスキップチケットがいっぱいになったって～。んじゃ、あんパン買ってきてよ"
102601,3,"ギルドハウスのスタミナがいっぱいだよ。あたしの代わりに働いて来ておくれ～"
102601,4,"ギルドハウスのEXPポーションが貯まってるよ。あたしは成長してもぐうたらし続けるからね"
102601,5,"ギルドハウスのマナがいっぱいだってさ。ゲームと高級あんパンを買っとくれ"
102601,6,"ギルドハウスで受け取れるアイテムが、すべていっぱいになりました…ふぅ、お知らせだけで疲れた"
102701,1,"スタミナが全回復したようですわね。これであなた様で様々な実験ができますわ…クスクス♪"
102701,2,"ギルドハウスのスキップチケットがいっぱい…バトルをスキップして、二人でゆっくりしましょう"
102701,3,"ギルドハウスのスタミナが回復したみたいですわ。体力に満ちあふれたあなた様を…クスクス♪"
102701,4,"ギルドハウスのEXPポーションがいっぱいのようです。薬はよいものですわ…クスクス♪"
102701,5,"ギルドハウスのマナがいっぱいですわ。あなた様が何を買うかは、私が管理しますわね。"
102701,6,"ギルドハウスのアイテムが全部いっぱい…あなた様のものは私のもの、あなた様も私のものですわ♪"
102801,1,"あら、スタミナが全快してるわね。体力が余ってるなら、あたしの仕事、手伝ってくれない？"
102801,2,"ギルドハウスのスキップチケットがいっぱいよ、もったいない。早く取りに来なさい？"
102801,3,"んもぅ、ギルドハウスのスタミナが余ってるわよ。何をするにしても体力は重要だわ。"
102801,4,"ギルドハウスのEXPポーションがいっぱいね。経験は大事よ。成長するために不可欠なんだから。"
102801,5,"ギルドハウスのマナが限界まで貯まったわね。お金もマナも天下の回りもの。大事にしなさい。"
102801,6,"ギルドハウスで受け取れるアイテムが全部いっぱいね。こういうのサボると後で大変よ？"
102901,1,"スタミナが全回復したみたいだし、私のライブ、見に来て欲しいな♪"
102901,2,"ギルドハウスのスキップチケットがいっぱいになったよ。レッスンも効率的になるかな？"
102901,3,"ギルドハウスのスタミナがいっぱいだね。お出かけの誘いなら、いつでも待ってるよ♪"
102901,4,"ギルドハウスのEXPポーションがいっぱいみたい。アイドルとしてもっと成長できるかも！"
102901,5,"ギルドハウスのマナがいっぱいだね。よかったら一緒に舞台、見に行かない？"
102901,6,"ギルドハウスで受け取れるアイテムが、全部いっぱいだね。沢山の贈り物。アイドルみたいだね♪"
103001,1,"スタミナが全回復デース！天下統一を目指すのデス！"
103001,2,"ギルドハウスのスキップチケットがいっぱいデース！まさに忍法、ムササビの術デス！"
103001,3,"ギルドハウスのスタミナがいっぱいデース！きっと兵糧丸と同じ効果があるのデス！"
103001,4,"ギルドハウスのEXPポーションがいっぱいみたいデース！新たな忍法を閃きそうデス！"
103001,5,"ギルドハウスのマナがいっぱいのようデス！たくさん貯めて、お城を買うのデス！"
103001,6,"ギルドハウスで受け取れるアイテムが、すべていっぱいデス！全部、天下統一に必要なものデス！"
103101,1,"スタミナが全回復したみたいですね。彷徨う哀れな魂の救済に行きましょう"
103101,2,"ギルドハウスのスキップチケットがいっぱいですよ…と、あなたの後ろにいる女の子が言っています"
103101,3,"ギルドハウスのスタミナがいっぱいのようです。除霊の依頼が来ているので、手伝っていただけませんか？"
103101,4,"ギルドハウスのEXPポーションがいっぱいになりました。一人前の霊媒師に近づけるでしょうか？"
103101,5,"ギルドハウスのマナがいっぱいになったからなんか奢れ！…い、いまのは父の発言です"
103101,6,"私の占いによると、ギルドハウスで受け取れるアイテムが、すべていっぱいになったみたいです…"
103201,1,"スタミナが全回復したようですわ！時は金なりといいますし、さっそく参りましょう！"
103201,2,"ギルドハウスのスキップチケットがいっぱいですわね。これがあれば方向音痴も関係ないですわ！"
103201,3,"ギルドハウスのスタミナがいっぱいですわ。魔物討伐の際には、騎士として雇わせて貰えます？"
103201,4,"ギルドハウスのEXPポーションがいっぱいですわ！きっと商人としての経験も積めますわね！"
103201,5,"ギルドハウスのマナがいっぱいですわよ。家一軒くらい、買えるかもしれませんわ。"
103201,6,"ギルドハウスで受け取れるアイテムが、全部いっぱいですわね。あら、執事はいませんの？"
103301,1,"スタミナが全回復したべ。ささっ、お仕事の時間だべ！"
103301,2,"ギルドハウスのスキップチケットがいっぱいだべ！漫才の練習も効率的になるべか？"
103301,3,"ギルドハウスのスタミナがいっぱいになったべな。牧場の仕事、がんばるべ！"
103301,4,"ギルドハウスのEXPポーションがいっぱいだべさ。これでもっとみんなを笑わせられそうだべ！"
103301,5,"ギルドハウスのマナがいっぱいだど？　マナを受け取らないのはマナー違反だべ！"
103301,6,"ギルドハウスで受け取れるアイテムが、すべていっぱいだべな。何かお笑いに使えるべか？"
103401,1,"スタミナが全回復したみたいだし…わ、私に会いに来てくれたりしないかなぁ？"
103401,2,"ギルドハウスのスキップチケットがいっぱいよ。二日酔いの時間が短くなったりしないかしら…？"
103401,3,"ギ、ギルドハウスのスタミナがいっぱいみたいだし…一緒にお出かけ…する？"
103401,4,"ギルドハウスのEXPポーションがいっぱいね。まさか、飲んだら酔ったりしないわよね…。"
103401,5,"ギルドハウスのマナがいっぱいだわ。一杯飲みにいきましょ！あなたはジュースね♪"
103401,6,"ギルドハウスで受け取れるアイテムが、すべていっぱいね。わ、私もプレゼント欲しいなぁ…？"
103601,1,"スタミナが全回復しましたよ。お知らせをしてもらわないと忘れちゃうなんて、仕方のない人です"
103601,2,"ギルドハウスのスキップチケットがいっぱいです。宿題も終わったので、一緒にお出かけしましょう"
103601,3,"ギルドハウスのスタミナがいっぱいになりました。これで鉄棒のテストはバッチリですね"
103601,4,"ギルドハウスのEXPポーションがいっぱいです。ふふん、すぐに成長してあなたに追いつきますよ！"
103601,5,"ギルドハウスのマナがいっぱいですね。え？なにか買ってあげる？やっぱりふしんしゃさんですね"
103601,6,"ギルドハウスで貰えるアイテムがいっぱいです。こんなに貯めて…ちゃんと回収してくださいね？"
103701,1,"スタミナが全回復したね。任務開始といこうか。"
