unit_id,notif_type,comment
108201,6,"ギルドハウスで貰えるアイテムがいっぱいなの！とっとと受け取ってハロウィンするの！"
108301,1,"スタミナが全回復したわよ。ハロウィンの街に繰り出しましょ！"
108301,2,"ギルドハウスのスキップチケットがいっぱいだわ！さ、アタシをデートに連れて行きなさい？"
108301,3,"ギルドハウスのスタミナがいっぱいね。お菓子を貰いに行きましょ。あんたが食べたそうにしてるし"
108301,4,"ギルドハウスのEXPポーションがいっぱいね！成長して、魔性の女になっちゃうわ♪"
108301,5,"ギルドハウスのマナがいっぱいじゃない！…なによ？はしゃいでなんてないわよ！"
108301,6,"ギルドハウスで貰えるアイテムがいっぱいだわ！お菓子もこれも、受け取り忘れないようにね！"
108401,1,"スタミナが全回復しましたね。これで聖夜のステージを歌い切れます…聴いてくださいね。"
108401,2,"ギルドハウスのスキップチケットがいっぱいになりましたね。聖夜の贈り物、大切に使いましょう！"
108401,3,"ギルドハウスのスタミナがいっぱいになりましたね。サンタさんからのプレゼントでしょうか？"
108401,4,"ギルドハウスのEXPポーションがいっぱいになりましたね。これでもっと素敵な聖歌が歌えるかも…"
108401,5,"ギルドハウスのマナがいっぱいになりましたね。ふふ、クリスマスパーティーをしましょうか？"
108401,6,"ギルドハウスで受け取れるアイテムが、いっぱいになりましたね。聖夜の冒険に役立てましょう！"
108501,1,"スタミナが全回復したみたい…お、お兄ちゃん、クリスマスの町を一緒に歩きませんか…？"
108501,2,"ギルドハウスのスキップチケットがいっぱいですぅ…。このチケットで、クリスマスの舞台が観れたらいいなぁ…♪"
108501,3,"ギルドハウスのスタミナがいっぱいですぅ…。あの…よかったらお芝居の練習を手伝ってくれませんか…？"
108501,4,"ギルドハウスのEXPポーションがいっぱい…成長すれば、人見知りとか口下手も治ったりするのかなぁ…？"
108501,5,"ギルドハウスのマナがいっぱい…。クリスマスですし、無駄遣いしても、ちょっとだけなら黙っていてあげますぅ♪"
108501,6,"ギルドハウスで受け取れるアイテムが、全部いっぱい…。きっと、お兄ちゃんへのクリスマスプレゼントですね…♪"
108601,1,"スタミナ全回復～♪お兄ちゃん、一緒にクリスマスのお買い物に行こうよ～！"
108601,2,"ギルドハウスのスキップチケットがいっぱいだよぉ！おっきな広場にお出かけして、雪だるまとか作りたいなー♪"
108601,3,"ギルドハウスのスタミナがいっぱいだよぉ！さっそく、クリスマスパーティーをはじめちゃおー♪"
108601,4,"ギルドハウスのEXPポーションがいっぱい！ぷうきちが飲んだら、成長して大きくなるのかな？"
108601,5,"ギルドハウスのマナがいっぱいだよぉ！これだけあれば、デッカい七面鳥も甘ぁいケーキも食べ放題だよね♪"
108601,6,"ギルドハウスで受け取れるアイテムが、全部いっぱい！受け取らないと、ぷうきちサンタが子供たちに配っちゃうよ♪"
108801,1,"スタミナが全回復したみたい。あ、あのね騎士クン…一緒に初詣に行きたいんだけど…ダメかな？"
108801,2,"ギルドハウスのスキップチケットがいっぱい。外に行くなら、初日の出が綺麗に見える場所がいいな…。"
108801,3,"ギルドハウスのスタミナがいっぱいだよ。お正月用のお餅を準備しないと…騎士クンも来てくれるとうれしいな。"
108801,4,"ギルドハウスのEXPポーションがいっぱいだね。わたしも強くなって、自分の想いを伝えられるぐらいの勇気が欲しいな…。"
108801,5,"ギルドハウスのマナがいっぱいになったみたい。お正月にお買い物するなら…福袋とかどう？"
108801,6,"ギルドハウスのアイテムがいっぱい。お正月で忙しいよね。あの…ここにはおせちもあるし、ゆっくり過ごせると思うよ…？"
108901,1,"スタミナが全回復したようだね。お正月だからって怠けすぎは禁物だよ。一緒に特訓しよう！"
108901,2,"ギルドハウスのスキップチケットがいっぱいか。修業を早く終わらせて、お正月の町をゆっくり歩くのもいいね。"
108901,3,"ギルドハウスのスタミナがいっぱいだね。この時期にしかできない、雪上での戦闘訓練をしてみようか。"
108901,4,"ギルドハウスのEXPポーションがいっぱいだね。強さへの探究はどんな時でも持っていないと。例えそれがお正月でもね。"
108901,5,"ギルドハウスのマナがいっぱいだ。これだけあるなら、お正月の初売りに行くとか…その…私は今日、空いているのだけど？"
108901,6,"ギルドハウスで受け取れるアイテムがすべていっぱいだよ。正月ボケしてないで取りに来て…私だって待ってるんだから。"
108701,1,"スタミナが全回復したよっ！お正月だし、一緒に羽根突きしようよ！騎士くんを墨だらけにしちゃうんだから♪"
108701,2,"ギルドハウスのスキップチケットがいっぱい！ねえねえ、外で凧あげしようよ！どっちが高く上げられるか競争だよ！"
108701,3,"ギルドハウスのスタミナがいっぱいだよ！お家の中でできる事…あ、みんなを呼んで、カルタで遊ぼうよー♪"
108701,4,"ギルドハウスのEXPポーションがいっぱいだよ！もっと強くなって、色んな人を助けられるようになりたいな！"
108701,5,"ギルドハウスのマナがいっぱい！ねえねえなんに使うの？あたしとしては、出店のイカ焼きがお奨めかな♪"
108701,6,"ギルドハウスのアイテムがぜんぶいっぱい！あたしが整理して…あれ？なんか崩れて…き、騎士くん！早く取りに来て！"
109001,1,"スタミナが全回復しましたわ。とろけるようなバレンタイン、私とずっと一緒に過ごしましょう…"
109001,2,"ギルドハウスのスキップチケットがいっぱいですわね…チョコレートの材料集めに役立ちそうですわ"
109001,3,"ギルドハウスのスタミナがいっぱい…クスクス。外出するのでしたら、ついていきますわ…どこまでも"
109001,4,"ギルドハウスのEXPポーションがいっぱいですわ…チョコレートに混ぜて…冗談ですわ。クスクス…"
109001,5,"ギルドハウスのマナがいっぱいになっていますわ。もっと強くなって、よりよい材料を手に入れますわね"
109001,6,"ギルドハウスで受け取れるアイテムがいっぱいになっています…あなた様が受け取りに来るのを待っていますわ…いつまでも…クスクス"
109101,1,"スタミナ全回復だよっ！バレンタインは、お姉ちゃんと一緒に甘い時間を過ごそうね♪"
109101,2,"ギルドハウスのスキップチケットがいっぱいだね！バレンタインだって冒険しちゃう？もちろんお姉ちゃんもついていくよっ♪"
109101,3,"ギルドハウスのスタミナがいっぱいになってるよ！あま～い一日、お姉ちゃんと一緒にたくさんお出かけしよっ♪"
109101,4,"ギルドハウスのEXPポーションがいっぱいみたいだよ！お姉ちゃんもっと強くなっちゃうね♪"
109101,5,"ギルドハウスのマナがいっぱいだよ～。使い道は、お姉ちゃんが管理してあげようか？"
109101,6,"ギルドハウスで受け取れるアイテムがいっぱいだね！お姉ちゃんと一緒にお片づけしよっか。上手にできたらたくさん褒めてあげちゃう♪"
109201,1,"スタミナが全回復したんだって！さあ、出発しようよ！"
109201,2,"ギルドハウスのスキップチケットがいっぱいになったよ！こっちこっち、早く～！"
109201,3,"ギルドハウスのスタミナがいっぱいだよ！よぉし、頑張るぞ～！"
109201,4,"ギルドハウスのEXPポーションがいっぱいになったよ！冒険に役立てようね！"
109201,5,"ギルドハウスのマナがいっぱいになったよ！大切に使おうね！"
109201,6,"ギルドハウスで受け取れるアイテムが、すべていっぱいになったみたいだよ！"
109301,1,"スタミナが全回復したですぅ！一緒に遊びに行くです～！"
109301,2,"ギルドハウスのスキップチケットがいっぱいになったです！楽しくせいしゅんするですぅ！"
109301,3,"ギルドハウスのスタミナがいっぱいですぅ！これでたくさん遊べるですね！"
109301,4,"ギルドハウスのEXPポーションがいっぱいですぅ！さっそく使うです！"
109301,5,"ギルドハウスのマナがいっぱいになったです！ルゥお菓子が食べたいですぅ！"
109301,6,"ギルドハウスで受け取れるアイテムが、すべていっぱいになったですぅ！"
109401,1,"スタミナが全回復したよ。じゃあ、冒険に出かけようか"
109401,2,"ギルドハウスのスキップチケットがいっぱいになったね。見に来たほうがいいかも…"
109401,3,"ギルドハウスのスタミナがいっぱいになったよ。そろそろ出かけない…？"
109401,4,"ギルドハウスのEXPポーションがいっぱいになったね。もっと強くなれるかな…"
109401,5,"ギルドハウスのマナがいっぱいになったね。使いすぎには気をつけないと…"
109401,6,"ギルドハウスで受け取れるアイテムが、すべていっぱいになったよ"
109501,1,"スタミナが全回復したようですね…はっ！まさか万全のスタミナでクウカの帯を…！？"
109501,2,"ギルドハウスのスキップチケットがいっぱいです…！戦いを急いで終わらせて、じっくりとクウカの着物を…！？"
109501,3,"ギルドハウスのスタミナがいっぱいですぅ！一気に使ってクウカを休ませないつもりですね！？"
109501,4,"ギルドハウスのEXPポーションがいっぱいになっていますよ…。クウカを成長させて、もっと色々なことを…！？"
109501,5,"ギルドハウスのマナがいっぱいです…！い、いけませんドSさん、クウカが欲しいだなんて…ぐふふ"
109501,6,"ギルドハウスのアイテムがいっぱいになっています…！まとめてクウカも受け取ってしまうのですね…じゅるり…！"
109601,1,"スタミナが全回復しまシタ！オシノビでお出かけしマショウ！"
109601,2,"ギルドハウスのスキップチケットがいっぱいデスよ！ショーグンと天下統一を目指してシュラシュシュシュデース！"
109601,3,"ギルドハウスのスタミナがいっぱいデス！オタノシミはこれからデース！"
109601,4,"ギルドハウスのEXPポーションがいっぱいデス！もっと忍術を磨いて、無敵の忍者になりマス！"
109601,5,"ギルドハウスのマナがいっぱいデース！これでクニトリ合戦も有利になるデスね！"
109601,6,"ギルドハウスで受け取れるアイテムがいっぱいデス！ヒャクマンゴクの勢いデス！"
109701,1,"スタミナがすべて回復しているみたいです。冒険に出かけませんか？"
109701,2,"ギルドハウスのスキップチケットがいっぱいのようです。受け取っておきましょう"
109701,3,"ギルドハウスのスタミナがいっぱいになっているようです。もったいないですから受け取っておきましょう"
109701,4,"ギルドハウスのEXPポーションがいっぱいのようです。レムに使ってくれてもいいんですよ？"
109701,5,"ギルドハウスのマナがいっぱいのようです。この世界のマナは不思議ですね"
109701,6,"ギルドハウスで受け取れるアイテムが全ていっぱいのようです。レムが片付けてしまう前に回収しておいてくださいね"
109801,1,"スタミナが全て回復したようね。ラムに付いてきて欲しいの？仕方がないわね。感謝なさい"
109801,2,"ギルドハウスのスキップチケットがいっぱいよ。戦いを手早く終わらせるのはいいことね"
109801,3,"ギルドハウスのスタミナがいっぱいになっているわ。さぁ、ラムの代わりに頑張りなさい"
109801,4,"ギルドハウスのEXPポーションがいっぱいね。強さを求めるのは当然ね。しっかり励みなさい"
109801,5,"ギルドハウスのマナがいっぱいになっているわよ。せいぜい使い道には気を付けることね"
109801,6,"ギルドハウスのアイテムがいっぱいですって。ラムに片付けろと言うのかしら？まぁ、面倒だけどやってあげるわ"
109901,1,"スタミナが全部回復したみたい！ねえ、どこかにいってみない？"
109901,2,"ギルドハウスのスキップチケットがいっぱいね！すごーく便利そうだし受け取っちゃおう！"
109901,3,"ギルドハウスのスタミナがいっぱいよ！無駄になっちゃう前に受け取っておこ？"
109901,4,"ギルドハウスのEXPポーションがいっぱいみたい。ね、早く受け取っちゃいましょ"
109901,5,"ギルドハウスのマナがいっぱい！これだけマナがあったらパックもよろこぶかな？"
109901,6,"ギルドハウスで受け取れるアイテムが全ていっぱいね。これだけあればいろんなことできちゃいそう"
110001,1,"スタミナが全回復したよ！波がヒデサイを待ってるよ！"
110001,2,"ギルドハウスのスキップチケットがいっぱいだよ！便利だから使うしかなくない？"
110001,3,"ギルドハウスのスタミナがいっぱいだって！早く受け取りに行こっ！"
110001,4,"ギルドハウスのEXPポーションがいっぱいだって！これがあればもっともにカワになっちゃうよね！"
110001,5,"ギルドハウスのマナがいっぱいみたい！受け取らなきゃおこだよ！"
110001,6,"ギルドハウスがアイテムでいっぱいだよ～！ギルドハウスがパンパン～！超ウケる！"
110101,1,"スタミナが全回復したわ！今だけは宿題を忘れて、思いっきりバカンスを楽しんじゃおう！"
110101,2,"ギルドハウスのスキップチケットがいっぱいだわ！これで夏の海も100点満点ね！"
110101,3,"ギルドハウスのスタミナがいっぱいだよ。泳ぎの練習に付き合ってくれない？"
110101,4,"ギルドハウスのEXPポーションがいっぱいだわ。これで泳げるようになっちゃうかも～？"
110101,5,"ギルドハウスのマナがいっぱいになったよ。海の家で一緒になにか食べない？"
110101,6,"ギルドハウスで受け取れるアイテムが、全部いっぱいだよ！ビーチで遊べそうな物もないか、見てみましょう？"
110301,1,"スタミナが全回復したみたいよ。元気があるなら、ひと泳ぎしない？"
110301,2,"ギルドハウスのスキップチケットがいっぱいみたい。受け取らなきゃもったいないわよ"
110301,3,"ギルドハウスのスタミナがいっぱいみたいよ。みんなと砂遊びでもする？"
110301,4,"ギルドハウスのEXPポーションがいっぱいよ。これを糧に上を目指しましょ"
110301,5,"ギルドハウスのマナがいっぱいみたい。新ビジネスの元手になるかしら？"
110301,6,"ギルドハウスで受け取れるアイテムがいっぱいみたい。貯めこむとあとが大変よ？"
110401,1,"おい、スタミナが全回復してるぞ。海辺の冒険にでも行こうぜ、あたしも付いていってやるからよ！"
110401,2,"ギルドハウスのスキップチケットがいっぱいだ。戦いはさっさと済ませて、泳ぎにでも行こうぜ"
110401,3,"ギルドハウスのスタミナがいっぱいだな。いいぜ、どこにでも付き合ってやるよ！"
110401,4,"ギルドハウスのEXPポーションがいっぱいみたいだぜ。強くなるのはいいことさ、守れるヤツが増えるからな！"
110401,5,"ギルドハウスのマナがいっぱいだってよ。なんに使うか知らねぇけど、あとで困らないようにしろよな"
110401,6,"ギルドハウスで受け取れるアイテムがいっぱいじゃねぇか！仕方ねぇな、あたしも手伝うから、受け取りに行こうぜ"
110501,1,"スタミナが全回復してみなぎってるさ～！歌って踊りながら、冒険に出発さ～！"
110501,2,"ギルドハウスのスキップチケットがいっぱいだね～！戦いを素早く終わらせて、海に飛び込むさ～！"
110501,3,"ギルドハウスのスタミナがいっぱいだよ～！まだまだ元気いっぱい遊べるさ～！"
110501,4,"ギルドハウスのEXPポーションがいっぱいさ～！踊りのキレがよくなるかも～！"
110501,5,"ギルドハウスのマナがいっぱいになってるさ～？夏の陽気に身を任せて、ぱーっと使っちゃうさ～！"
110501,6,"ギルドハウスで受け取れるアイテムがみ～んないっぱいさ～！まとめて受け取って、海を満喫しちゃうさ～！"
110601,1,"スタミナが全回復してはりますよ。一緒に不思議の国に行きまひょか♪"
110601,2,"ギルドハウスのスキップチケットがいっぱいになっとるねぇ。急ぐんは苦手やけど、王子はんと一緒なら平気どす…♪"
110601,3,"ギルドハウスのスタミナがいっぱいどすなぁ。うちと一緒に、海でたくさん遊びませんか…？"
110601,4,"ギルドハウスのEXPポーションがいっぱいになっとるよ。ぎょうさん溜め込んで、一気に使うんどすか？"
110601,5,"ギルドハウスのマナがいっぱいなんやって。王子はんはこつこつ貯めるタイプなんやね。素敵やわぁ"
110601,6,"ギルドハウスで受け取れるアイテムがいっぱいや！みらくるまほりん…え？魔法でお片付け、したらあきまへんか？"
107001,1,"スタミナが全回復していますね。さあ、行きましょう。私が一緒に戦ってあげますよ"
107001,2,"ギルドハウスのスキップチケットが貯まりました。さっさと受け取りなさい。楽をしたくはないのですか？"
107001,3,"ギルドハウスのスタミナが貯まりました。ずいぶんと余裕があるのですね。でしたら少し手伝いなさい"
107001,4,"ギルドハウスのEXPポーションがいっぱいですよ。私がいただいておきます。…ダメですか？"
107001,5,"ギルドハウスのマナがいっぱいです。これで私の能力に、より磨きをかけられますね"
107001,6,"ギルドハウスで受け取れるアイテムが全て貯まっています。私が使いたいので早く受け取っておきなさい"
110701,1,"スタミナが全回復しました。これで、ぼっちとバイバイできるかな…？"
110701,2,"ギルドハウスのスキップチケットがいっぱいですよ…！友達作りには…使えませんよね。そうですよね…"
110701,3,"ギルドハウスのスタミナがいっぱいになっています！どうしよう、自己紹介の練習でもしましょうか！？"
110701,4,"ギルドハウスのEXPポーションがいっぱい…これを一気飲みすれば、成長して友達も…！？"
110701,5,"ギルドハウスのマナがいっぱいです！新しいだいじょぶマイフレンドくんを作ってもいいですか…？"
110701,6,"ギルドハウスで受け取れるアイテムが、いっぱいいっぱいみたいです…まるで人と話してるときの私のよう…！"
110801,1,"ちょ、やばい、スタミナ全回復してる。なんかした方がいいんじゃないの、知んないけど"
110801,2,"ウケる。ギルドハウスのスキップチケット、なんか溢れかえってンですけど"
110801,3,"ウケる。ギルドハウスのスタミナ、なんか溢れかえってンですけど"
110801,4,"ウケる。ギルドハウスのEXPポーション、なんか溢れかえってンですけど"
110801,5,"ウケる。ギルドハウスのマナ、なんか溢れかえってンですけど"
110801,6,"ヤバい。ギルドハウスで受け取れるアイテム、全部フル貯まってる。そろそろ取りに来てくんない"
111101,1,"スタミナが全回復しています。一緒にハロウィンパーティ、行きますか？仕方ないので、ついていってあげます"
111101,2,"ギルドハウスのスキップチケットがいっぱいじゃないですか。急ぎ過ぎて、転んだりしちゃダメですよ？"
111101,3,"ギルドハウスのスタミナがいっぱいになってますよ？あなたも仮装して、お菓子をもらいに行きますか？"
111101,4,"ギルドハウスのEXPポーションがいっぱいです。成長したら、お菓子をもらえなくなっちゃうのかな…？"
111101,5,"ギルドハウスのマナがいっぱいですので、お菓子作りしませんか？子供たちに配る分です。もちろん、あなたにもあげますよ"
111101,6,"ギルドハウスで受け取れるアイテムがいっぱいじゃないですか！早く受け取って、ハロウィンを楽しまないとですよ！"
111201,1,"にいちゃん、スタミナが全回復したよ！ハロウィンパーティーしよう！"
111201,2,"ギルドハウスのスキップチケットがいっぱいになったって！トリックオアチケット～！"
111201,3,"ギルドハウスのスタミナがいっぱいになったよ！お菓子余ってるならミソギにちょうだい！"
111201,4,"ギルドハウスのEXPポーションがいっぱいだよ！これで、とびっきりのいたずらできるかも！"
111201,5,"ギルドハウスのマナがいっぱいになったよ！これでミソギにお菓子買ってくれる～？"
111201,6,"ギルドハウスのアイテムがいっぱいになったよ！何も仕掛けてないから取りに来て！にひひ♪"
111301,1,"スタミナがぜんかいふくだって、おにいちゃん！ミミとハロウィンパレードしよ～♪"
111301,2,"えへへ、トリックオアトリート～♪ギルドハウスのスキップチケットがいっぱいだよ、おにいちゃん！"
111301,3,"おにいちゃん、ギルドハウスのスタミナがいっぱいだよ！ハロウィンのおようふくでお出かけしようよ～♪"
111301,4,"おにいちゃん！ギルドハウスのEXPポーションがいっぱいだから、たくさん使って楽しくハロウィンしよ～♪"
111301,5,"ギルドハウスのマナがいっぱいなんだって！おにいちゃん、ミミのお菓子も買ってくれるかなぁ…"
111301,6,"おにいちゃん！ギルドハウスのアイテムがぜんぶいっぱいになったみたいだよ！えへへ、ハッピーハロウィン～♪"
111401,1,"スタミナが全回復したよ。ねぇ、遊びにいってくれないの？"
111401,2,"ギルドハウスのスキップチケットがいっぱいだよ！はやく使おうよー！"
111401,3,"ギルドハウスのスタミナがいっぱいだよ！ねーねー、まだお出かけしないの？"
111401,4,"ギルドハウスのEXPポーションがいっぱいになったよ！ルナも使ってみたいなー！"
111401,5,"ギルドハウスのマナがいっぱいになったよ！ルナ、マナってキラキラしてて好きだなー！"
111401,6,"ギルドハウスで受け取れるアイテムが、全部いっぱいになったよー！"
106501,1,"スタミナが全回復したぜ！ケンカの準備、完了だ！さあオレと一緒に大暴れしにいこうぜ！"
106501,2,"ギルドハウスのスキップチケットがいっぱいになったってさ。せっかくのケンカ、楽して進んじゃうのか？"
106501,3,"ギルドハウスのスタミナがいっぱいになったぜ！たぎるケンカがどんだけできるかな？思いっきり楽しもうぜ！"
106501,4,"ギルドハウスのEXPポーションがいっぱいになったぜ！どんどん使って強くなって、連勝記録更新といこうぜ！"
106501,5,"ギルドハウスのマナがいっぱいになったぜ。溜めててもしょうがねえ。早く使っちまおうぜ！なあ、いいだろ？"
106501,6,"ギルドハウスで受け取れるアイテムが全部いっぱいになったぜ！こんだけありゃ、もっとケンカを楽しめるな！"
111501,1,"スタミナが全回復しているな。これなら存分にクリスマスを愉しむことができそうだな♪"
