unit_id,notif_type,comment
180301,4,"ギルドハウスのEXPポーションがいっぱいだね。私の技も思いも、まだまだ成長していくよ。"
180301,5,"ギルドハウスのマナがいっぱいだね。その、誰に渡すか決めてないなら…私がもらってもいい？"
180301,6,"ギルドハウスで受け取れるアイテムがすべていっぱいだ。寂しくないと言ったら嘘になるね…キミに会いたいな。"
117001,1,"スタミナが全回復しましたわ。あぁ、真夏の海であなた様を…さあ、早く参りましょう…"
117001,2,"ギルドハウスのスキップチケットがいっぱいになりました…こちらを使って空いた時間で、ゆっくりと海を満喫しましょう…"
117001,3,"ギルドハウスのスタミナがいっぱいになりましたわ。これでまた一緒に海に行けますわね…"
117001,4,"ギルドハウスのEXPポーションがいっぱいですわ。私たちの夏のために、有意義に使いましょう…"
117001,5,"ギルドハウスのマナがいっぱいのようですわ。これで終わらない夏を手に入れましょう、あなた様…"
117001,6,"ギルドハウスで受け取れるアイテムがいっぱいですわ。これで、海へ行く準備は万端ですわね…"
117101,1,"スタミナが全回復したよ弟くん！これはもう、海でお姉ちゃんと一緒に遊び尽くすしかないねっ！"
117101,2,"ギルドハウスのスキップチケットがいっぱいになってるね。遠慮せず使っちゃおうよ！そしてお姉ちゃんと夏をエンジョイしようねっ♪"
117101,3,"ギルドハウスのスタミナがいっぱいだから、お姉ちゃんが来たよ！夏を楽しむ計画はお姉ちゃんに任せてねっ♪"
117101,4,"ギルドハウスのEXPポーションがいっぱいだよ～♪お姉ちゃんもまだまだ成長途中！弟くんと一緒に、夏の海ですくすく育っちゃうよ♪"
117101,5,"ギルドハウスのマナがいっぱいだね！ここはお姉ちゃんの出番かな？夏は開放的になっちゃうから、お姉ちゃんがしっかりと管理してあ・げ・る♪"
117101,6,"ギルドハウスで受け取れるアイテムがすべていっぱいなのは、お姉ちゃんになんとかしてほしいからだねっ？ふふっ、甘えん坊さん♪"
117201,1,"スタミナ全回復したんだって！ねぇ、どこに遊びに行く？夏だし、やっぱり海？それとも山？両方行っちゃおっか♪"
117201,2,"ギルドハウスのスキップチケット、いっぱいみたい。サマーライブを楽しむためにも、どんどん使っていこうよ！"
117201,3,"ギルドハウスのスタミナがいっぱいだよ。サマーライブ、最後まで全力で楽しんでいってね♪"
117201,4,"ギルドハウスのEXPポーションがいっぱいだって。もっと成長したいな。この夏、誰よりも輝きたいから！"
117201,5,"ギルドハウスのマナがいっぱいだよ。花火でも買って、ビーチに遊びに行こう！ぜーったい楽しいよ♪"
117201,6,"ギルドハウスで受け取れるアイテムが、全部いっぱいだよ。もしかして、私のグッズもあったりするかな…？"
117401,1,"騎士さんのスタミナが全回復してますね！ほらほら、夏バテしてる場合じゃありませんよ！"
117401,2,"ギルドハウスのスキップチケットがいっぱいです！夏は短いんですから、使っておかないと損しますよ！"
117401,3,"ギルドハウスのスタミナがいっぱいになってます！サマーライブで忙しいんですから、ちゃっちゃと取りに行きますよ！"
117401,4,"ギルドハウスのEXPポーションがいっぱいですよ！せっかくいい天気なんです、早く回収して海へ行きましょう！"
117401,5,"ギルドハウスのマナがいっぱいですよ。貯めるのも大事ですけど、使うのはもっと大事です！というわけで、海の家へ行きますよ！"
117401,6,"ギルドハウスで受け取れるアイテムが、すべていっぱいになってますよ！騎士さん、夏休みを満喫するためにも取りに行った方がいいですって！"
117301,1,"スタミナが全回復したようですね。夏のステージは体力勝負です。気合を入れていきましょう"
117301,2,"ギルドハウスのスキップチケットがいっぱいです。サマーライブのレッスン時間の確保ができそうですね"
117301,3,"ギルドハウスのスタミナがいっぱいになっています。コンディションはばっちり…最高の夏の歌が歌えそうです"
117301,4,"ギルドハウスのEXPポーションがいっぱいのようです。新たな力で、唱喚士として海辺の平和を守ってみせます！"
117301,5,"ギルドハウスのマナ、いっぱいですね。よければ、なんですが…アイスでも食べにいきませんか？"
117301,6,"ギルドハウスで受け取れるアイテムが、すべていっぱいです。海の精霊と共に、あなたを待っています"
180701,1,"あっ、スタミナが回復したみたいだよ～！お出かけしようよ、キミも、シオリンも一緒に♪"
180701,2,"ギルドハウスのスキップチケットがいっぱいみたいですよ。お姉ちゃんと３人でピクニックに行きませんか？"
180701,3,"ギルドハウスのスタミナがいっぱいです…私、お姉ちゃんに伝えてきますね。みんなで一緒に取りに行きましょう！"
180701,4,"ギルドハウスのEXPポーションがいっぱいだよ！これで私たち、もっともっとパワーアップできるかな！？"
180701,5,"ギルドハウスのマナがいっぱいみたいです。何に使うか…迷っちゃいますね。３人で相談しませんか？"
180701,6,"ギルドハウスで受け取れるアイテムが全部いっぱいなのだ！キミとシオリンと私で張り切って使っちゃうぞ～☆"
117501,1,"スタミナが全回復したわよ。診察のお手伝い、よろしくお願いするわね♪"
117501,2,"ギルドハウスのスキップチケットがいっぱいみたいね。もったいぶらずに使って、効率的な治療に役立てましょう♪"
117501,3,"ギルドハウスのスタミナがいっぱいになってるわ。医療の現場は体力勝負よ、忘れずに手に入れて有効活用しましょう"
117501,4,"ギルドハウスのEXPポーションがいっぱいになったわ。患者のためにも、最新の医療技術を身に着けて成長しなくちゃね"
117501,5,"ギルドハウスのマナがいっぱいね。早く回収しないと、私がカンポーの仕入れ用に使っちゃうわよ♪"
117501,6,"ギルドハウスで受け取れるアイテムが全部いっぱいだわ…悪いけど診察で手が離せないの。回収してきてもらえないかしら？"
117601,1,"スタミナが全部回復してるね。かわいいボクが特別に冒険に付き合ってあげるよ。うれしいでしょ♪"
117601,2,"ギルドハウスのスキップチケットがいっぱいになってるね。ボクの美しさのために役立てちゃおうよ！"
117601,3,"ギルドハウスのスタミナがいっぱいだよ。ボクのかわいさを広めるために出かけよう！"
117601,4,"ギルドハウスのEXPポーションがいっぱいだね。ボクだけじゃ持ちきれない…腕が太くなっちゃうから、早く取りにきてよ！"
117601,5,"ギルドハウスのマナがいっぱいになったよ。これだけあれば、いろんな美容グッズが買えちゃうね！"
117601,6,"ギルドハウスで受け取れるアイテムが、全部いっぱいだよ。早く回収してボクのさらなる美の研究を続けないと！"
118001,1,"スタミナが全回復しましたわ！わたくしバリバリ働きますわよ～！"
118001,2,"ギルドハウスのスキップチケットがいっぱいになったそうですね。あのク…眼鏡の協会派遣員が待っておりますわ"
118001,3,"ギルドハウスのスタミナがいっぱいになりましたわ。これで残業もこなせますわね♪"
118001,4,"ギルドハウスのEXPポーションがいっぱいになりましたわよ。お茶の代わりに一服しませんこと？"
118001,5,"ギルドハウスのマナがいっぱいになったようですわね。無駄にしてはなりませんわよ？"
118001,6,"ギルドハウスで受け取れるアイテムが、すべていっぱいになりましたわ！さぁさ、我が陛下に献上するのです！"
117701,1,"スタミナが全回復したみたいだね～♪ハロウィンセイバーズ、出動さ～！"
117701,2,"ギルドハウスのスキップチケットがいっぱいさ～！これがあればたくさんサーターアンダギーを作れるさ～♪"
117701,3,"ギルドハウスのスタミナ、いっぱいだよ～？一緒にランドソルのハロウィンを楽しみ尽くすさ～！"
117701,4,"ギルドハウスのEXPポーションがいっぱいさ～！これでお菓子作りの腕も上がったりしないかな～？"
117701,5,"ギルドハウスのマナがいっぱいだね～せっかくのハロウィンだし、イタズラグッズでも買いにいくさ～♪"
117701,6,"ギルドハウスのアイテムがいっぱいさ～！早く受け取りに来てね～お菓子を用意して待ってるさ～♪"
117801,1,"スタミナが全回復したデス！ハロウィンセイバーズ、出動デース！"
117801,2,"ギルドハウスのスキップチケットがいっぱいデス！踊れや騒げや、ハロウィンパレードに出かけまショウ！"
117801,3,"ギルドハウスのスタミナがいっぱいになりまシタ！ヒャッキヤコウを始めまショウ！"
117801,4,"ギルドハウスのEXPポーションがいっぱいになりまシタ！悪霊退治に活かすデース！"
117801,5,"ギルドハウスのマナがいっぱいデス！バラまいて家来を増やすデス！宵越しのゼニは持ちまセン！"
117801,6,"ギルドハウスで受け取れるアイテムがすべていっぱいになりまシタ！金銀財宝ウハウハデース！"
117901,1,"スタミナが全回復したよヒデサイ！ハロウィンセイバーズ、しゅっつどーう！"
117901,2,"ギルドハウスのスキップチケットがいっぱいだって！ハロウィンの人気スポット、全部回れるかも？"
117901,3,"ギルドハウスのスタミナがいっぱいになったって！ハロウィンの屋台、もう一巡りいっちゃおー！"
117901,4,"ギルドハウスのEXPポーションがいっぱいだって！たくさん使って最高のハロウィンにしちゃおうよ、ヒデサイ！"
117901,5,"ギルドハウスのマナがいっぱいじゃん！ヒデサイ、ハロウィンでみんなに配るお菓子買ってこ～♪"
117901,6,"やばばば！ギルドハウスで受け取れるアイテムが全部いっぱいだって！もらってハロウィンパーティーの続きしよーよ！"
118501,1,"スタミナが全回復しました！元気にたくさん依頼をこなしてくださいね♪"
118501,2,"ギルドハウスのスキップチケットがいっぱいです！空いた時間で書類仕事を手伝ってもらってもいいですか？"
118501,3,"ギルドハウスのスタミナがいっぱいになりました。新規の依頼をお願いさせてください♪"
118501,4,"ギルドハウスのEXPポーションがいっぱいになりました。これを飲んで高難度の依頼に挑戦しましょう！"
118501,5,"ギルドハウスのマナがいっぱいです。有効活用して立派なギルドに成長してくださいね♪"
118501,6,"ギルドハウスで受け取れるアイテムが、すべていっぱいになりました！備品の補充も大事な仕事ですよ！"
106701,1,"スタミナが全回復したよ～☆元気なら私とおでかけしてほしいな～♪"
106701,2,"ギルドハウスのスキップチケットがいっぱいだね♪じゃんじゃん使っちゃおう～☆"
106701,3,"ギルドハウスのスタミナがいっぱいだ～☆これだけあれば、もっと一緒に戦えるね…♪"
106701,4,"ギルドハウスのEXPポーションがいっぱいになったね～☆私を強くしてくれるよね～？"
106701,5,"ギルドハウスのマナがいっぱいになったよ～♪使い道は私がちゃ～んと見ておくね…☆"
106701,6,"ギルドハウスで受け取れるアイテムが全部いっぱいだって～☆もっと楽しいことができそう…わくわくしてきちゃった～♪"
119001,1,"スタミナが全回復したわ〜！愛と希望とちょっぴりの闇の力で、秘密の授業スタート♪"
119001,2,"ギルドハウスのスキップチケットがいっぱいになったよ。ドキドキで楽しい授業にしちゃうね♪"
119001,3,"ギルドハウスのスタミナがいっぱいになって、愛と希望の力もみなぎったわ！街の風紀を守りましょう♪"
119001,4,"ギルドハウスのEXPポーションがいっぱいになったわよ。もっと愛と希望を教えてあげられそう♪"
119001,5,"ギルドハウスのマナがいっぱいになったわ！『秘密の学び舎』のお手入れをしちゃおうかな？うふふ♪"
119001,6,"あ〜んっ！ギルドハウスで受け取れるアイテムが、全部いっぱいになったわ〜！もうダメ、あふれちゃう〜！"
119101,1,"スタミナが全回復しました～♪ドＳさんのみなぎる野性を闇のドＭ、クウカにぶつけてください～♪"
119101,2,"ギルドハウスのスキップチケットがいっぱいですぅ…クウカを手早く攻略してしまおうというのですか！？"
119101,3,"ギルドハウスのスタミナがいっぱいに～♪ぐふふ…クウカと一緒に全部解き放ちましょう～！"
119101,4,"ギルドハウスのEXPポーションがあふれちゃいそうですぅ～！クウカの妄想を成長させましょう～！"
119101,5,"ギルドハウスのマナがいっぱいですよ～？ク、クウカに注ぎ込もうというのですか！？なんというドＳ！"
119101,6,"ギルドハウスで受け取れるアイテムがすべていっぱいですう！闇の力があふれちゃう前に片付けましょう～♪"
119901,1,"スタミナが全回復したの～！みんなにクリスマスプレゼントを配りにいくの。オマエも手伝うの～！"
119901,2,"ギルドハウスのスキップチケットがいっぱいなの！じゃんじゃん使ってクリスマスプレゼントを配りまくるの！"
119901,3,"ギルドハウスのスタミナがいっぱいなの。プリンはいっぱいじゃないの？さっさとミヤコにプリンをよこすの～"
119901,4,"ギルドハウスのEXPポーションがいっぱいなの～！これだけあればミヤコは無敵のサンタになれるの～！"
119901,5,"ギルドハウスのマナがいっぱいになったの！これでクリスマス限定の特別なプリンを買うの～！"
119901,6,"ギルドハウスで受け取れるアイテムが全部いっぱいなの！メリープリンクリスマスなの～♪"
119201,1,"スタミナが全回復したべや。クリスマスは書き入れ時だ。あんちゃん、張り切っていくべ！"
119201,2,"ギルドハウスのスキップチケットがいっぱいみてぇだな。さっさと仕事終わらして、クリスマスパーティーするべさ！"
119201,3,"ギルドハウスのスタミナがいっぱいになってんな。これでクリスマス用のお笑いネタもばっちり練習できるべ♪"
119201,4,"ギルドハウスのEXPポーションがいっぱいだべ。これ飲んで、牧場の雪かきも行商もまとめて乗り切るべよ！"
119201,5,"ギルドハウスのマナがいっぱいになってるべや。これで牧場のみんなにクリスマスプレゼント買ってくべ♪"
119201,6,"ギルドハウスで受け取れるアイテムが全部いっぱいだべ。そんじゃ、あんちゃんも一緒にクリスマスプレゼントの仕分けすっか！"
119301,1,"スタミナが全回復しましたよ、お兄ちゃん♪いざ、クリスマスデートに出発です！"
119301,2,"ギルドハウスのスキップチケットがいっぱいですよ！強引矢のごとし！ぱぱっと片づけちゃいましょ～！"
119301,3,"ギルドハウスのスタミナが満タンです！これでクリスマスの間はずっとお兄ちゃんと過ごせそうですね♪"
119301,4,"ギルドハウスのEXPポーションがいっぱいですね。もっと出来る妹になって、お兄ちゃんを守ってみせます♪クリスマスの誓いですよ～！"
119301,5,"ギルドハウスのマナがいっぱいですよ！これで毎日でもクリスマスデートに行けちゃいますね！早速今日のデートに出発です～！"
119301,6,"ギルドハウスのアイテムが全部いっぱいです～！この中に、お兄ちゃんから私へのクリスマスプレゼントが…！！え？違う？"
120801,1,"スタミナが全回復したってさ。それじゃああたしと正月の遊びでもしようじゃないか"
120801,2,"ギルドハウスのスキップチケットがいっぱいだね。混んじまう前にさっさと初詣に行っとくかい？"
120801,3,"ギルドハウスのスタミナがいっぱいだね。少し遠出して初日の出を拝みに行こうか"
120801,4,"ギルドハウスのEXPポーションがいっぱいだね。おせちと一緒に一杯やろうかね"
120801,5,"ギルドハウスのマナがいっぱいだってさ。せっかくだしお高めなおせちでも買うとしようか"
120801,6,"ギルドハウスで受け取れるアイテムがいっぱいじゃないか。こいつがあれば正月がいっそう華やぐってもんさ"
180801,1,"るんたった～♪スタミナがかいふくしたよ。おにいちゃん、ミミたちと一緒におさんぽしにいこう♪"
180801,2,"ギルドハウスのスキップチケットがいっぱいになりましたよ。私たち秘密基地へ行くんですけど…あなたも一緒にどうですか？"
180801,3,"ギルドハウスのスタミナがいっぱいになったってさ！にいちゃんもミソギたちと一緒に遊びに行こうよ！"
180801,4,"ギルドハウスのEXPポーションがいっぱいになったよ♪ミミたちもっとせーちょーするからね、おにいちゃん♪"
180801,5,"ギルドハウスのマナがたまったようです。無駄遣いしないようにみんなで使い方を話し合わないと。あなたも相談にのってください。"
180801,6,"ギルドハウスで受け取れるアイテムがぜーんぶいっぱいになったよ！にいちゃん、みんなで力を合わせて取りに行こうよ！"
120701,1,"スタミナが全回復したわ。私、正月のお祭りへ行ってみたいのだけど、一緒についてきてくれるかしら？"
120701,2,"ギルドハウスのスキップチケットがいっぱいになったわ。取りに行くついでに、みんなへ新年のあいさつをしましょうか"
120701,3,"ギルドハウスのスタミナがいっぱいになったみたいね。太るのはイヤだけど…お参りに行く前に体力つけておかないと"
120701,4,"ギルドハウスのEXPポーションがいっぱいになったわね。お年玉同様、無駄な使い方をしないようにしましょう"
120701,5,"ギルドハウスのマナがいっぱいになったみたい。コッコロさんのためにも無駄遣いしないように気を付けなくちゃね"
120701,6,"ギルドハウスで受け取れるアイテムが、全部いっぱいになっているわ。新年を気持ちよく過ごせるように、整理しに行くのはどうかしら？"
120901,1,"スタミナが全回復しておるぞ。さあ、ぐずぐずするでない、わらわとともに正月を制覇しにゆくのじゃ！"
120901,2,"ギルドハウスのスキップチケットがいっぱいのようじゃな。お主が使わぬなら、わらわが新春の世界征服に活用してしまうぞ？"
120901,3,"ギルドハウスのスタミナがいっぱいになっておる。この正月を遊びつくすには十分な量じゃな。お主のエスコート、期待しておるぞ♪"
120901,4,"ギルドハウスのEXPポーションがいっぱいじゃぞ。ふふ、これだけあれば真の姿を保つのに役立つかもしれぬ。景気よく使ってみるのじゃ！"
120901,5,"ギルドハウスのマナがいっぱいのようじゃ。これだけあればお年玉にも新春の買い物にも困らぬ。豪勢な正月になりそうじゃの♪"
120901,6,"ギルドハウスにアイテムがいっぱい届いておるぞ。せっかくの正月じゃからのう、みなに景気よく振る舞ってはどうじゃ？"
121001,1,"ひゅうひゅう♪スタミナ全回復です！大事な仲間たちと、全力全開の冒険に出かけましょう～！"
121001,2,"ギルドハウスのスキップチケットがいっぱいです！楽しくて賑やかな冒険ができますよ！やばいですね☆"
121001,3,"ギルドハウスのスタミナがいっぱいですよ！おいしいご飯を食べる準備はできました！さあ出かけましょう！"
121001,4,"ギルドハウスのEXPポーションがいっぱいになりましたよ！じゃんじゃん使って全力を超えましょう〜！"
121001,5,"ギルドハウスのマナがいっぱいになりました！仲間と囲む幸せな食卓のために使っていきましょう！"
121001,6,"ギルドハウスで受け取れるアイテムが全部いっぱいです！あふれちゃう前に、一緒に受け取りにいきましょう☆"
121201,1,"おや、スタミナが全回復したね。新しい力を振るう機会がちょうど欲しかったんだ"
121201,2,"ギルドハウスのスキップチケットがいっぱいだ…思い切ってさくっと使ってみよう！"
121201,3,"ギルドハウスのスタミナがいっぱいだってさ。少年、お姉さんにもその元気、分けてくれる？"
121201,4,"ギルドハウスのEXPポーションがいっぱいじゃないか。天才に経験を積ませると最強になるって、知ってた？"
121201,5,"ギルドハウスのマナがいっぱいになったね。少年からいただきものなんてうれしいな！あれ、アタシにじゃないの…？"
121201,6,"ギルドハウスで受け取れるアイテムが、すべていっぱいになったよ！少年もアタシと一緒で忙しいんだね…こっちで預かっておこうか？"
116401,1,"ぽーん！スタミナが全回復しました！ドクター・ユニがお待ちです、馬車馬のように働いてください！"
116401,2,"ふむ、ギルドハウスのスキップチケットが上限に達しているな。有って困るものではない、回収したまえ"
116401,3,"ふむ、ギルドハウスのスタミナが上限に達しているな。いざ聖学祭を制覇するぞ、ユニちゃんズ出陣だ！"
116401,4,"ほわあああポーションが！ギルドハウスのEXPポーションが容量いっぱい！何コレもったいなぁ～！"
116401,5,"ふむ、ギルドハウスのマナが上限に達しているな。学びに必要なものだ、無駄にするんじゃあない"
116401,6,"おい大変だ、ギルドハウスで受領可能なすべてのアイテムが溢れかえっている。呑気に尻を掻いている場合ではないぞ"
121101,1,"スタミナが全回復したわ。さっさと準備して出かけましょ！…あたし、なにか美味しいものが食べたいわ。もちろん魔物料理以外でね♪"
121101,2,"ギルドハウスのスキップチケットがいっぱいだってさ。楽できる時は楽しなくちゃね！"
121101,3,"ギルドハウスのスタミナがいっぱいよ。あんたのことだし人助けでもするつもりでしょ。特別に付き合ってあげるわ！"
121101,4,"ギルドハウスのEXPポーションがいっぱいよ。もっと強くなりたい…あんたとつないだ手を、もう離したくないから"
121101,5,"ギルドハウスのマナがいっぱいね。ちょっと奮発して、いつもより高めのメニュー頼んじゃいましょっか♪"
121101,6,"ギルドハウスで受け取れるアイテム、全部いっぱいよ。ったく、早く受け取りに来なさいよね…待っててあげるからさ"
118101,1,"スタミナが全回復したみたい…。帰ってきたら、わたしの歌…聴いてね…？"
118101,2,"ギルドハウスのスキップチケット、溢れてしまって…。ぅぅ…どうすれば、いいのかしら…？"
118101,3,"ギルドハウスのスタミナが、いっぱいよ…。あのっ、お出かけするなら…一緒に…はうぅ…"
118101,4,"ギルドハウスのEXPポーション、いっぱいよ…。たくさん飲んで…大きく…"
118101,5,"ギルドハウスのマナが、いっぱいになったわ…。預かっておくから…待ってるわね…"
